{
  "confidence": 0.9,
  "context_id": "33333333-3333-4333-8333-333333333333",
  "context_type": "ROOM_OCCUPIED",
  "evidence": [
    {
      "capability": "occupancy.motion",
      "device_id": "motion_living",
      "event_id": "11111111-1111-4111-8111-111111111111",
      "note": null,
      "observed_at": "2026-08-20T19:29:20Z",
      "room_id": "living_room",
      "status": "KNOWN",
      "value": true
    }
  ],
  "expires_at": "2026-08-20T19:35:00Z",
  "home_id": "home_example",
  "last_updated_at": "2026-08-20T19:30:00Z",
  "metadata": {},
  "producer": "context-engine",
  "reason_codes": [
    "ROOM_MOTION_DETECTED"
  ],
  "scope": "room:living_room",
  "started_at": "2026-08-20T19:29:20Z"
}
